ID,Difficulty,Question,Option A,Option B,Option C,Option D,Correct Answer,Hint
m141,hard,What is the inverse of the function f(x) = 3x + 2?,f⁻¹(x) = (x - 2)/3,f⁻¹(x) = (x + 2)/3,f⁻¹(x) = 3x - 2,f⁻¹(x) = x/3 - 2,f⁻¹(x) = (x - 2)/3,"Switch x and y: x = 3y + 2. Solve for y: x - 2 = 3y, so y = (x - 2)/3."
m142,easy,What is 13 + 27?,38,40,42,44,40,"Add 13 + 27. You can think: 10 + 20 = 30, plus 3 + 7 = 10, so 30 + 10 = 40."
m143,medium,What is the volume of a cylinder with radius 4 cm and height 10 cm? (Use π ≈ 3.14),125.6 cm³,251.2 cm³,502.4 cm³,"1,004.8 cm³",502.4 cm³,"Volume = π × r² × h. Square the radius (16), multiply by π (3.14), then by height (10): 16 × 3.14 × 10 = 502.4."
m144,hard,What is the axis of symmetry of the parabola y = -2x² + 8x - 5?,x = 2,x = -2,x = 4,x = -4,x = 2,"For ax² + bx + c, the axis of symmetry is x = -b/(2a). Here, x = -8/(2×-2) = -8/-4 = 2."
m145,easy,What is 9²?,18,72,81,90,81,9² means 9 × 9. Multiply 9 by itself to get 81.
m146,medium,What is 2.5 × 6?,12,15,18,20,15,2.5 = 5/2. So 2.5 × 6 = (5/2) × 6 = 5 × 3 = 15.
m147,hard,What is the simplified form of (x + 5)²?,x² + 25,x² + 10x + 25,x² + 5x + 25,x² + 10x + 10,x² + 10x + 25,Use the formula (a + b)² = a² + 2ab + b². So (x + 5)² = x² + 2(x)(5) + 5² = x² + 10x + 25.
m148,easy,What is 48 ÷ 6?,6,7,8,9,8,Think: what number times 6 equals 48? Or divide 48 by 6.
m149,medium,What is the perimeter of a rectangle with length 12 cm and width 8 cm?,20 cm,40 cm,96 cm,80 cm,40 cm,"Perimeter = 2(length + width). Add 12 + 8 = 20, then multiply by 2."
m150,hard,"What is the range of the data set: 5, 8, 12, 15, 20, 25?",15,20,25,30,20,"Range = maximum - minimum. The highest value is 25 and the lowest is 5, so 25 - 5 = 20."